{
  "result": "recorded",
  "status": "active",
  "licenceToken": null,
  "licence": {
    "licenceId": "01K5M1GR8T000000000000Y002",
    "kind": "full",
    "source": "local",
    "expiresAt": "2027-03-31T23:59:59Z",
    "maxRegisters": 2,
    "features": [
      "whatsapp"
    ],
    "limits": null
  },
  "portalTimeUtc": "2026-09-26T10:15:00Z",
  "nextCheckAfterSeconds": 86400,
  "messages": []
}
